[
  { "schema_version": "1.0.0", "status": "success", "runner_exit_code": 0, "phase_1_exit_code": 0, "artifacts": { "core": ["core/requirement-package.json", "core/policy-manifest.json"], "adapter": ["adapters/example-adapter/implementation-plan.json"] }, "diagnostics": [] },
  { "schema_version": "1.0.0", "status": "input_error", "runner_exit_code": 2, "phase_1_exit_code": 2, "artifacts": {}, "diagnostics": [{ "code": "CES_INPUT_INVALID", "source": "phase_1_exit_code", "severity": "error", "message": "Phase 1 rejected the supplied input." }] },
  { "schema_version": "1.0.0", "status": "execution_error", "runner_exit_code": 1, "artifacts": {}, "diagnostics": [{ "code": "CES_CHECKOUT_FAILED", "source": "phase_2_runner", "severity": "error", "message": "The pinned CES checkout failed." }] },
  { "schema_version": "1.0.0", "status": "blocked", "runner_exit_code": 3, "phase_1_exit_code": 3, "artifacts": { "core": ["core/policy-manifest.json"] }, "diagnostics": [{ "code": "CES_POLICY_BLOCKED", "source": "policy_manifest", "severity": "error", "message": "A mandatory policy could not be resolved.", "policy_id": "REPLACED_RESOURCE_LIFECYCLE" }] },
  { "schema_version": "1.0.0", "status": "conflict", "runner_exit_code": 4, "phase_1_exit_code": 4, "artifacts": { "core": ["core/policy-manifest.json"] }, "diagnostics": [{ "code": "CES_POLICY_CONFLICT", "source": "policy_manifest", "severity": "error", "message": "Policy inputs conflict.", "policy_id": "FILE_SIZE_LIMIT" }] },
  { "schema_version": "1.0.0", "status": "adapter_gap", "runner_exit_code": 5, "phase_1_exit_code": 5, "artifacts": { "core": ["core/policy-manifest.json"], "adapter": ["adapters/example-adapter/adapter-report.json"] }, "diagnostics": [{ "code": "CES_ADAPTER_GAP", "source": "adapter_report", "severity": "error", "message": "The selected adapter has a mandatory mapping gap.", "adapter_id": "example-adapter" }] }
]
